{
  "id": "example:record",
  "recordType": "Core.Object",
  "schemaVersion": 1,
  "createdAt": "2026-10-01T07:10:00.000Z",
  "updatedAt": "2026-10-01T07:10:00.000Z",
  "ownerId": "local:owner",
  "type": "example",
  "handleRefs": [],
  "shape": "example",
  "payloadRef": "example",
  "provenanceRefs": []
}